source_key,source_name,part,division,subdivision,section,section_title,content
ca_gazette17,Prescription of Amount of Indebtedness of Company under paragraph 466(1)(a) (GN No. 21841 of 2020),No. 21841.,,,No. 21841.,No. 21841.,"PERENGGAN 466(1)(a)
PRESCRIPTION OF AMOUNT OF INDEBTEDNESS OF COMPANY
UNDER PARAGRAPH 466(1)(a)"
ca_gazette17,Prescription of Amount of Indebtedness of Company under paragraph 466(1)(a) (GN No. 21841 of 2020),No. 21841.,,,"Act 2016 [Act 777], the Minister prescribes the amount of indebtedness of a","Act 2016 [Act 777], the Minister prescribes the amount of indebtedness of a","company for the purposes of that paragraph shall be an amount exceeding
fifty thousand ringgit with effect from 1 January 2021 until 31 March 2021."
ca_gazette17,Prescription of Amount of Indebtedness of Company under paragraph 466(1)(a) (GN No. 21841 of 2020),No. 21842.,,,No. 21842.,No. 21842.,"PELANTIKAN PEGAWAI-PEGAWAI PERUBATAN SEBAGAI PEGAWAI
PAKAR MENGIKUT PERINTAH 27 BAB 'F' PERINTAH-PERINTAH AM"
